{
  "@context": "https://schema.org",
  "@type": "SportsEvent",
  "openbookVersion": "0.3.0-draft",
  "id": "EVT-88213",
  "sequence": 104870,
  "dateModified": "2026-09-12T18:02:11Z",
  "name": "Arsenal v Manchester City",
  "sport": {
    "id": "sport:soccer",
    "name": "Soccer"
  },
  "league": {
    "id": "LG-17",
    "name": "Premier League",
    "territory": "GB-ENG",
    "competitionType": "league",
    "gender": "men",
    "ageGroup": "open",
    "sameAs": "https://www.wikidata.org/entity/Q9448"
  },
  "season": {
    "id": "S-2025",
    "name": "2025-26"
  },
  "stage": {
    "id": "ST-REG",
    "name": "Regular Season",
    "stageType": "phase"
  },
  "startDate": "2026-09-19T14:00:00Z",
  "cutoffDate": "2026-09-19T14:00:00Z",
  "eventStatus": "scheduled",
  "participants": [
    {
      "id": "T-3",
      "name": "Arsenal",
      "territory": "GB-ENG",
      "role": "home",
      "order": 1,
      "sameAs": "https://www.wikidata.org/entity/Q9617"
    },
    {
      "id": "T-11",
      "name": "Manchester City",
      "territory": "GB-ENG",
      "role": "away",
      "order": 2,
      "sameAs": "https://www.wikidata.org/entity/Q50602"
    }
  ],
  "location": {
    "name": "Emirates Stadium",
    "addressLocality": "London",
    "territory": "GB-ENG",
    "timeZone": "Europe/London",
    "latitude": 51.555,
    "longitude": -0.108,
    "sameAs": "https://www.wikidata.org/entity/Q19478"
  },
  "surface": "grass",
  "identifier": [
    {
      "propertyID": "sportradar",
      "value": "sr:match:8412480"
    }
  ]
}